{
  "authors": [
    "Microsoft Xbox"
  ],
  "id": "xbox-global-platform-baselines",
  "notes": "First-party AC-wall telemetry model. The 127 W Series X shooter-genre average is the central console coefficient for the fixed gaming reference row.",
  "order": 19,
  "organization": "Microsoft Xbox",
  "publishedDate": "2026-03-04",
  "sourceTier": "Tier 1",
  "sourceType": "First-party global telemetry model",
  "tags": [
    "gaming",
    "devices"
  ],
  "title": "Introduction to global platform baselines",
  "url": "https://learn.microsoft.com/en-us/xbox/sustainability/global-platform-baselines",
  "usedFor": [
    "Xbox Series X central console coefficient",
    "gaming-console method"
  ]
}
