{
  "authors": [
    "Simon P. Couch"
  ],
  "id": "simon-couch-coding-agent",
  "notes": "Historical provenance for the retired hourly coding-agent row. Couch's personal token-log analysis remains illustrative evidence, but it does not support the former undocumented four-hour normalization or the new request coefficient.",
  "order": 5,
  "organization": "Simon P. Couch",
  "publishedDate": "2026-01-20",
  "sourceTier": "Tier 3",
  "sourceType": "Expert analysis",
  "tags": [
    "scenarios",
    "prompting",
    "historical provenance"
  ],
  "title": "Electricity use of AI coding agents",
  "url": "https://www.simonpcouch.com/blog/2026-01-20-cc-impact/",
  "usedFor": [
    "historical provenance for the retired coding-agent hour row",
    "comparison context for variation in coding-agent workloads"
  ]
}
