{
  "authors": [
    "Laure De Roucy-Rochegonde",
    "Adrien Buffard"
  ],
  "id": "ifri-ai-dc-energy",
  "notes": "Useful for prompt comparison tables and the Jevons framing, but should be paired with Tier 1 sources where possible.",
  "order": 4,
  "organization": "IFRI",
  "publishedDate": "2025-02-01",
  "sourceTier": "Tier 2",
  "sourceType": "Policy report",
  "tags": [
    "prompting",
    "debates"
  ],
  "title": "AI, Data Centers and Energy Demand: Reassessing and Exploring the Trends",
  "url": "https://www.ifri.org/sites/default/files/2025-02/ifri_buffard-rochegonde_ai_data_centers_energy_2025_2.pdf",
  "usedFor": [
    "image-generation benchmark row",
    "comparison logic in the cloud-side versus total-system bridge"
  ]
}
